{"baseline":{"bundleSha256":"333876aeff0bb4e8b37b3cc40da0b3d2f96a19db798d665a009a18c23b8d96b4","captureId":"a2","captureSha256":"70c805ae390b416f80c16f256af0bf584350c49ca2b77df6a8e55826e3b2f247","productionSha256":"f03d33dcc733f51b6f1fcb37acef57f9fb27616d3b1430a07c024bac8861ec50","treatmentGitSha":"1111111111111111111111111111111111111111"},"calibration":{"a1CaptureId":"a1","a2CaptureId":"a2","bCaptureId":"b","evidenceSha256":"7f1d4638da223d2a890d2f0856cb9cc1bb3a27de89bd92a530c49628cd651aea","passed":true},"candidate":{"bundleSha256":"84da2f5cf38469d988e279ec72924dbd86914a6a09d6ded7ac5b7663c6896913","captureId":"b","captureSha256":"9eba07a46b8bb46360e063743d5969b68a3a5395298167e746f93cf230d5d062","productionSha256":"bbbbbbbbbbbbbbbbbbbbbbbbbbbbbbbbbbbbbbbbbbbbbbbbbbbbbbbbbbbbbbbb","treatmentGitSha":"9999999999999999999999999999999999999999"},"cells":[{"directionOutcome":"improvement","estimate":{"gainPercent":9.999999999999998,"lower95Ratio":0.9,"pointRatio":0.9,"upper95Ratio":0.9},"identity":{"batchSize":1,"benchmark":"com.salesforce.revoman.benchmark.RevUpV3WarmBenchmark.revUp","direction":"lower-is-better","mode":"ss","parameters":{},"primaryMetric":"score","profile":"warm","threads":1,"unit":"ms/op"},"policyOutcome":"not-enforced"}],"compatibility":"compatible","compatibilityReasons":[],"implementation":{"adapterSha256":"306c6ca7407560340797866e077e053627ad409277d1b9da58106fce4cf717cb","bootstrapVectorSha256":"5939445067bb315fd5cb7ac70bb8ef8afc9aa97428f347603a35428e834a3298","captureSchemaSha256":"6e8c9cf021830ffcced9aac195adb183516caf02a3487479a40a1dc104e7d9cf","comparatorSha256":"ea423c2836ffbf00a1aac22ae72b4935b6bd781b0480924362b4c3e1c35a45d7","comparisonSchemaSha256":"7202412cd71d4a5bea86759a00661d6af47384a9e96d807a02fd622e47927767","expectedCellsSha256":"9f34814cb1fa9baa9e41aaae7710cbd650878c3bd1902663d7184700d30a052c","protocolSha256":"fde5ee8f0b727f6455039f5c047410d4443c28909c4a183f4604f994a2c50cb2","qualificationPolicySha256":"d59cd9f9fc7cc1b6cbd53f3d32095a9e4bd343b5bc903cf48c257c938a9d8136","rendererSha256":"bbbbbbbbbbbbbbbbbbbbbbbbbbbbbbbbbbbbbbbbbbbbbbbbbbbbbbbbbbbbbbbb","runnerSha256":"241abeed3a5247b11a4d1d3f293dde453e89aca58f8f713a4668282d29b4c9b9"},"kind":"candidate","policy":{"outcome":"not-enforced"},"schemaVersion":"comparison-v1","strength":"diagnostic"}
